{
  "schema_version": "1.0",
  "artifact_type": "CollectionStrategy",
  "plan_id": "COLLECTION-example-001",
  "revision": 1,
  "mode": "strategy_only",
  "inputs": {
    "question": "Which evidence categories should the project collect next?",
    "out_of_scope": [
      "live network acquisition",
      "OCR or transcription",
      "canonical promotion"
    ],
    "scope_axes": {
      "core_topics": ["knowledge engineering"],
      "adjacent_topics": ["multimodal evidence"],
      "source_types": ["official standard", "primary research", "dataset"],
      "media_kinds": ["html", "pdf", "image", "video", "audio", "dataset"],
      "date_range": null,
      "languages": ["en", "ko"],
      "geographies": [],
      "evidence_strength": "body",
      "source_independence_required": true,
      "coverage_cells": [
        {
          "cell_id": "primary-research-pdf",
          "target_count": 1,
          "current_count": 0,
          "status": "gap"
        }
      ]
    },
    "source_priority_tiers": [
      {"tier": 1, "name": "official and primary", "allowed_use": "evidence"},
      {"tier": 2, "name": "publisher or institution", "allowed_use": "identity"},
      {"tier": 3, "name": "aggregator or search snippet", "allowed_use": "discovery_only"}
    ],
    "query_families": [
      {
        "family_id": "standards-and-primary",
        "queries": ["knowledge engineering provenance standard", "multimodal evidence primary research"],
        "max_hops": 1
      }
    ],
    "allowed_access_states": ["metadata_fetched", "body_verified"],
    "allowed_rights_states": ["rights_verified", "restricted", "unverified"],
    "budgets": {
      "max_batches": 0,
      "max_items": 0,
      "max_requests": 0,
      "max_bytes": 0,
      "max_elapsed_seconds": 0
    },
    "stop_rules": {
      "saturation_batches": 2,
      "material_gain_fields": [
        "identity_verified",
        "rights_verified",
        "body_verified",
        "locator_replayed",
        "independent_evidence",
        "coverage_cells_closed"
      ],
      "safety_halts": [
        "robots_disallow",
        "authentication_required",
        "paywall",
        "rate_limit",
        "private_data",
        "unsafe_redirect"
      ]
    }
  },
  "outputs": {
    "plan_path": "work/coordination/example/collection-plan.json",
    "catalog_path": null,
    "checkpoint_path": null,
    "metrics_path": null,
    "report_path": "work/coordination/example/analysis.md"
  },
  "authorized_stages": ["plan"],
  "batches": [],
  "checkpoint": {
    "last_completed_batch_id": null,
    "resume_stage": null,
    "query_cursor": null,
    "remaining_query_families": [],
    "candidate_snapshot_sha256": null,
    "unresolved": []
  },
  "decision": {
    "state": "completed",
    "reason": "Strategy-only plan and validation contract delivered without acquisition.",
    "resume_required": false
  },
  "metrics": {
    "denominators": {
      "required_candidates": 0,
      "required_coverage_cells": 1,
      "locator_eligible": 0
    },
    "counts": {
      "discovered": 0,
      "identity_verified": 0,
      "revision_verified": 0,
      "body_verified": 0,
      "rights_verified": 0,
      "locator_replayed": 0,
      "independent_sources": 0,
      "exact_duplicates": 0,
      "near_duplicate_groups": 0,
      "conflicts": 0,
      "abstentions": 0,
      "failures": 0,
      "coverage_cells_met": 0
    }
  },
  "validation": {
    "status": "passed",
    "checks": [
      {
        "name": "strategy_only_no_acquisition",
        "status": "passed",
        "evidence": "authorized_stages=[plan], batches=[], and all acquisition output paths are null"
      }
    ]
  }
}
